{"schema_version":"0.1.0","project_id":"courtyard-demo","id":"variant-82d8c3944ac04207169ab11c979643cefb53c150893f3414af32ff68918725ee","seed":42,"generation_algorithm":"chacha8-u53-massing-v1","shape":"l_shape","parameters":{"shape":"l_shape","origin_xy_m":[5.052881875657741,6.26847896731718],"width_m":8.669883398771178,"depth_m":25.041461336491903,"notch_width_m":1.9105379503345907,"notch_depth_m":9.916384614233756},"footprint_xy_m":[[5.052881875657741,6.26847896731718],[13.72276527442892,6.26847896731718],[13.72276527442892,21.393555689575326],[11.812227324094328,21.393555689575326],[11.812227324094328,31.309940303809082],[5.052881875657741,31.309940303809082],[5.052881875657741,6.26847896731718]],"storeys":3,"floor_to_floor_m":3.2}